id,text,label,Unnamed: 3
75519,The institute aims at addressing challenges faced by livestock farmers in Ghana.,Edwumakuw no ne tsirmu pɔw nye dɛ wɔbɔhwɛ aboa hɔn a wɔnyɛn mbowa wɔ ɔman Ghana mu no ma woenya hɔn haw no ne nyiano,
96424,"Therefore, eating and drinking the juice is very beneficial.","Ntsi, nsu no ne ndzii na no nnomee ho wɔ mfaso papaapa.",
95504,"This kente represents braveness, courage, inspiration.","Dɛm kente no gyina hɔ ma akokodur, akokodur, nkuranhyɛ.",
74440,Men don't want to accompany their wives for medical checkups.,Mbanyin mpɛ dɛ hɔn nye hɔn yernom bɔkɔ akɔhwɛ hɔn apom.,
95831,He entreated them to focus more on collective interests other than political interests to strengthen the unity of the country.,Ɔkyerɛɛ dɛ wɔmfa hɔn  enyi ntsim nkabomu dwumadzi do kyɛn pɛ a wɔwɔ no amanyɛ mu mfa mboa ma ɔman no ne nkabɔmu no ntsim yie,
94798,"The disease lasts for a long time, and when it spreads, it requires a complete breast amputation.","Yar no kyɛ, na sɛ ɔtserɛw a, ɔwɔ dɛ wotwa nye nufu koraa.",
96704,"He emphasized that, ""it would be paramount to invest in the important sectors","Ɔkaa no pi dɛ, ""Obehia dɛ wɔdze sika bɛhyɛ asoɛe a hɔ hia mu.",
95058,Doctor Jacqueline Mensah Darkwah is the medical doctor who opened up to us with the details of the news.,Datser Jacqueline Mensah Darkwah nye apɔwmudzen ho datsernyi a ɔdaa asɛm no nyina edzi kyerɛɛ hɛn.,
94422,"Subsequently, the Court presided over by Justice Sedinam Agbemava dismissed the case, fining the Senator GHC 5000 and dismissing the case.","Akyir yi, Asɛndzibea no dze Owura Justice Sedinam Agbemava n'enyim ma wɔbɔ asɛm no gu, na wɔbɔ no mbrahyɛbaguamnyi yi kaw Ghana sika mpem enum.",modified.
96225,"By the time he reached the age of eighty-eight, the business had made him a lot of money, and the restaurant he was admitted to had expanded and become very famous","Bɛpem ber a onyaa mfe eduowɔtwe awɔtwe no, nna n'edwuma no ama no sika pii, na edzibantɔmbea a wɔgyee no too mu no mu ebuei na ɔagye  dzin.",
94964,"The ministry of aviation added that, the Ashanti Airline company has began searching for qualified people to work with.","Wimuhɛn ho edwumayɛbea no dze kãa ho dɛ, Ashanti Wimuhɛn edwumakuw (Ashanti Airline company) no ahyɛase rehwehwɛ nyimpa a wɔfata a wɔnye hɔn bɛyɛ edwuma.",
75896,The workers vowed to double their efforts in an attempt to improve service delivery.,Edwumayɛfo no hyɛ bɔ dɛ wɔbɔbɔ hɔn mbɔdzembɔ ho ma woetum etu hɔn dwumadzi mu mpon.,
95147,Most of the citizens believe in him that he can do it and do it more.,Ɔmamfo dodowara gye no dzi dɛ obotum ayɛ na ɔayɛ no mbor do.,
95164,"For now, how can he say he wouldn't comply ?","Seseiara dze, obesidɛn aka dɛ ɔrenngye nntomu.",
95257,"On the day of their anniversary, Professor Attafuah made it known to all African countries that before they woild allow any foreigner to partake in their activities, Finance, and politics, they have to be conscious of their identity, and verify if the person have the identity card before.","Hɔn afedzi da no, Ɔbemfo Attafuah  daa no edzi ma Ebibirim aman nyinara enyim dɛ, ansaana wɔrobɔbɔ kwan ma ɔmamfranyi biara kwan ma ɔdze no ho ahyɛ hɔn dwumadzi, sikasɛm, na amanyɛsɛm mu no, ɔwɔ dɛ wohu hɔn ho, na wɔhwɛ sɛ ebia onyimpa no wɔ ahyɛnsewdze kaad ansaana.",
74531,Motorcycles can be used by doctors to reach health centres in time.,Adatserfo botum dze moto akɔ apɔwmudzenbea ahorow wɔ ber bi mu.,
95151,It was about 5minutes before the Ghana Fire Service and the Techiman Fire Service came to the scene to helped the victims.,Nna ɔyɛ bɛyɛ sima enum mu ansaana Ghana Odumgya Edwumakuw na Techiman Odumgya Edwumakuw no bɛba bea hɔ abɔboa hɔn a nna wɔka ho no.,
96212,He wanted to sit under a tree and write his death certificate and his handwriting,Nna ɔpɛ dɛ ɔtsena dua bi ase na ɔkyerɛw no wu krataa na ne nsaano akyerɛw,
94298,"Bathing: If you eat heavy food, do not eat it immediately, otherwise it will prevent the food from turning faster.","Eguar : sɛ idzi edziban a no mu yɛ dur a, mma nndzi no ntsɛntsɛm, annyɛ dɛm a obesiw edziban no kwan ma ɔnnyam ntsɛntsɛm.",
96630,"It is an interesting game. Some of the songs sing during the game is in session is ""Pempenaa, Nanaa!See, see, see, see dada koo..."". It is mostly played in the afternoon","Ɔyɛ agor a ɔyɛ enyika. Ndwom a wɔtow ber a agodzi no rokɔ do no mu bi nye Pempenaa, Anaa, sii sii sii, sii nana koo..."". Wɔtaa dzi no ewiaber.",
74679,People are now working from home as a result of the coronavirus outbreak in the country.,Seseiara dze nkorɔfo yɛ edwuma wɔ fie ɔnam coronavirus a ɔatsew esi ɔman no mu ntsi.,
94455,"The more blood flowed to all the organs, the more frequently the blood cells were getting stronger.","Mpɛn dodow a mbogya pem kɔ nyimpadua n'akwaa nyina no, ntsɛmdo na nkwamboaba no ho yɛ dzen.","Mpɛndodow a mbɔgya pem kɔ nyimpadua mfafakuwa nyina mu no, ntsɛm do na nkwambowaba no ho yɛ dzen."
73986,"At eight months, the baby died of coronavirus .","Abosoom awɔtwe no mu no,  coronavirus kaa abofra no ma owui.",
95103,"Although the man has retracted his words, but majority of the citizens said, because culture is not downtrodden by the one who knows it, they suggest that in a right way, Odike should have gone to the Ashanti King, Otumfoɔ Osei Tutu II palace and pleaded as required of the customs and traditions.","Ɔwɔ mu dɛ ɔatwe nsɛm no asan dze,naaso ɔmamfo dodow noara kaa dɛ, osiandɛ wommbu amambra enyimtsia wɔ obi a onyim dze ntsi, ne papa mu no wosusu dɛ, Odike bɔkɔ Esuantse hen, Otumfoɔ Osei Tutu II ahenfie na ɔkɛpakyɛw dɛ mbrɛ amambra na amandze tse no.",
96230,"Every time we could venture into a KFC restaurant, we see a picture of Colonel Sanders hanging in the restaurant or around the container for what you bought.","Ber biara a yebotum ewura KFC edzibantɔmbea no, yehu Colonel Sanders no mfonyin dɛ ɔsensan hɔ anaa w'edziban a etɔe no no nkondoo mu beebi.",
74465,Mobile money is the easiest way of transferring money to people in far areas.,Foon do sika nye ɔkwan a ɔyɛ mberɛw sen biara a wɔfa do dze sika kɛma nyimpa a wɔwɔ mbea a ɔwɔ ekyirkyir.,
75275,The district chairman contributed all roofing materials for the new church.,Mansin no ne guamutsenanyi no na ɔboaa nya nkyɛnsen dze kur asɔrdan fofor no,
76186,We were advised to use renewable energy sources so we wrote to the government seeking funding.,Wotuu hɛn fo dɛ yɛmfa ahoɔdzen a yetum dua kwan bi do ma no ahoɔdzen bio ntsi yɛkyerɛɛw krataa kɛmaa aban dze pɛɛ mboa.,
75890,The whole country is highly affected by the coronavirus pandemic and there will be a national fight against the coronavirus pandemic in our town.,Ɔmanmu no nyina enya coronavirus ɔyardɔm no ho nsunsuando na yɛbɛyɛ ɔman ko etsia ɔyardɔm no wɔ mo kurow mu.,
95630,"We always learn good things that will that will help our health, because if you have life there is everything.","Yɛtaa sua ndzɛmba papa a ɔbɔboa hɛn apɔwmudzen,  osiandɛ sɛ ewɔ nkwa a ewɔ adze nyina.",
76234,"With unity, people from different backgrounds and tribes can amicably work together.","Koryɛ mu no, nkorɔfo a hɔn nkyir nnyɛ pɛr na nyimpakuw ahorow botum abɔ mu ayɛ edwuma asomdwee mu.",
95407,"Before people got wisdom in working with machines, the Akans had ways of communication and how they led their life.","Ansaana nkorɔfo nyaa nyansa wɔ mfir edwumayɛ mu no, nna Akanfo wɔ akwan a wɔfa do twetwe nkɔmbɔ na kwan a wɔbɔɔ hɔn bra.",
95877,"There are two types of constipation, and thus, short-term and long-term.","Yɛwɔ ayamutsim ahorow ebein, na hɔn nye dza osi mber kakra bi ntamu na dza ɔkyɛr",
96250,The following are the different African countries whose names appeared and where they were in the survey.,Dza ɔka do yi nye Ebibirmu aman a hɔn edzin puee mu na bea wɔhyɛ wɔ nhwehwɛmu no mu.,
73968,Arsenal Football club lost to Leicester City football club yesterday.,Arsenal Bɔɔlbɔkuw no hweer konyimdzi no maa Leicester City Bɔɔlbɔkuw no ndeda.,
96439,"Apart from Vitamin E which helps cleanse the body, Vitamins B1, B3, B6 and B12 all help the body fight against asthma and Vitamin A also helps the eyes to function very well.","Iyi Vitamin E a ɔboa hohor nyimpadua no mu si nkyɛn a, vitamin B1, B3, B6 na B12 nyinara so boa nyimpadua no ma ɔko tsia ntehyewa na vitamin A so boa enyiwa no ma ɔyɛ edwuma yie.",
75315,The district leaders are aware of the health condition of our village.,Mpanyimfo a wɔda Mansin n'ano no nyim apɔwmudzen ho haw a ɔwɔ hɛn ekurase hɔ,
75102,The accounts office will do its best to pay the salaries on time.,Nkontaabu ɔfese no bɛyɛ dza obotum dze etua kaw no wɔ ne ber do.,
74651,Parents are advised to look for money earlier so that children sit exams.,Wɔhyɛ awofo nkuran dɛ wɔnhwehwɛ sika ntsɛm ansaana esuafo ahyɛ ase akyerɛw nsɔhwɛ.,
96274,"Blood clots can occur, causing blood loss and hospitalization.",Bɔgyatɔw tum ba a ɔma ehwer bɔgya na wɔgye wo to ayarsabea.,
95273,"President Akufo-Addo on August 17, 2021 initiated the 111 project.","Ɔmanpanyin Akufo-Addo daa 111dwumadzi no edzi wɔ Dzifuu 17,2021 mu.",
95666,They have items and some characters that when they do protects a pregnant woman and the baby in the womb.,Wɔwɔ ndzɛmba na ndzeyɛɛ bi a wɔyɛ dze bɔ ɔpemfo na abofra a ɔda yafun mu ho ban.,
96762,"Mmoatia are mythical forest creatures in Fante folklore. They are said to be small, human-like beings with magical powers and are often portrayed as mischievous or helpful spirits.","Mbowatsia yɛ ɔdomankomasɛm mu kwaa mu abɔdze bi a wɔwɔ Mfantse kodzisɛm mu. Wɔkyerɛ dɛ wosusuar, wɔtsetse dɛ nyimpa na woyi nkongyaa na wɔtaa da hɔn edzi dɛ wodzi nkorɔfo ho agor anaa esunsum a wɔboa.",
74659,Part of the money collected from taxes contributes to the building of roads.,Tow sika a wɔgyegye no mu bi na wɔdze boa yɛ akwan no.,
75117,The army served as the effective tool to procure captives.,Nsordaafo no somee dɛ akodze mapa a wɔdze nya ndɔmmumfo.,
73840,A public toilet will be constructed in my village.,Wobesi amansuon tsiafi wɔ m'ekuraase.,
95982,We can infer from this that each person's time to success is unique.,Yebotum aka dɛ nyimpa biara ne yieyɛ yɛ soronko,
75587,The match ended in a draw. Fans are cheering their respective teams.,Akansi no kɔr ewiei a atsenatow biara amba mu. Ekyirtaafo no ruhuhuor hɔn ekuw no.,
74340,Malaria testing kits are helping people living in rural remote areas in the absence of a doctor,Ndzɛmba a wɔdze sɔ papu (Malaria) mu nhwehwɛmu reboa nyimpa a wɔtse nkuraase mbea a ɔwɔ ekyirkyir a dɔkta nnyi hɔ,
75939,There has been a delay in the distribution of food during the lockdown.,"Ber a aban hyɛɛ mbra dɛ mma obiara mmpue no, edziban ne nkyɛe no kyɛree.",
73868,Access to health care services is important to good health.,Dɛ ibenya kwan wɔ apɔwmuhwɛ mapa ho yie ma apɔwmudzen mapa.,
95953,The porcupine is a very elusive and hard animal to kill.,Kɔtɔkɔ yɛ abowa a no ho dzen dɛ iboku no,
95125,"The unpeaceful voting that destroyed the democracy in Nairobi, Kennya has been restored and peaceful swear in their president today, different people and some dignitaries from all over the world went to support them.","Abatow a asomdwee ammba mu no asɛɛ kabi ma menkabi amambu wɔ Nairobi, Kennya egyina ne nan do na wɔdze hɔn manpanyin esi egua do asomdwee mu ndɛ, afofor na mpanyimfo ahorow a wɔwɔ wiadze yi mu kɛtaa hɔn ekyir.",
73911,"All seed needs water, oxygen, and warmth to grow.","Ndɔbaa nyina hia nsu, mframa na ewia dze enyin.",
96726,"Nana Kwadwo Adinkra's first son, Apau, who was well-skilled in crafting of the symbols, was arrested, and during his captivity, he shared valuable insights about the Adinkra symbols","Nana Kwadwo Adinkra ne ba banyin a odzi kan, Apau, a nna ɔwɔ nsɛnkyerɛdze ho edwindze ho nyimdzee yie no, wɔkyeer no, na ber a nna ɔda dua mu no, ɔnye hɔn kyɛɛ Adinkra nsɛnkyerɛdze ho nyimdzee no.",
94374,Some people can cook the grape juice mixed with some herbs and drink it to make themselves feel better.,Obinom nua brobe nsudeɛ no ka ahaban bi ho nom ma hɔn ho tɔ hɔn.,Binom noa grepu ka ahaban bi ho nom ma hɔn ho tɔ hɔn.
95795,How are they going to teach?' He asked rhetorically.,Wɔbɛyɛ dɛn akyerɛ adze? Obisae a ɔanngye nyiano biara,
96544,"During the court proceedings, the Attorney General presented a substantial amount of evidence against Aisha Huang to establish that she is guilt. Lawyer Alfred Tuah Yeboah is representing the prosecution in the case against Aisha Huang","Ber a asɛndzi no rokɔ do no, Ɔtsɛmbuafo Panyin no dase a no ho hia too gua tsiaa Aisha Huang dze kyerɛɛ dɛ odzi fɔ. Mbranyinfo Alfred Tuah Yeboah na ogyina mu ma nsɛm a wɔdze etsia Aisha Huang no.",
75378,"The establishment of the midwifery school was initiated by the woman leader, and the completion of the project has brought happiness to the community.","Mbaakuw panyin no na ɔmaa adwen dɛ wonsi bea a wɔbɛma nkorɔfo ntsetsee a wobotum dze agye awoo, na edwuma no n’ewiei no dze enyigye abrɛ hɔn a wɔtse brɔn no mu hɔ no",
75401,"The first missionaries to pre-colonial Ghana, were a multiracial mixture of European, African, and Caribbean pietists employed by Switzerland's Basel Mission.","Nna ɔman a wodzii kan dzii Ghana do no yɛ aforafora dɔm a wofi abrokyirmanmu, Ebibirmu na Caribbean a Switzerland asɔfo na wɔfaa hɔn",
75311,The district lands officer appealed people to keep their titles safery.,Mansin no nnyi sika pii wɔdze bɛyɛ nhyehyɛɛ mapa aboa no nkorɔfo,
75466,The government of Ghana sponsored some students to study from abroad.,Ghana aban asɔ esuafo binom asen dɛ wonkosua adze wɔ abrokyirman mu,
75831,The team was given a free kick in the last ten minutes.,Wɔmaa kuw no frii-kiike wɔ sima du a odzi ewiei no mu.,
74235,It's now ten years they have never received their spouses' benefits.,Afei ɔyɛ mfe du a hɔn ngyee hɔn ahokafo mfaso da.,
76102,Tohazie was a fighter. Yaa Asentewaa was a figther. Ghanaians are fighters. We shouldn't sit back with our arms folded and watch our country plundered to nothing.,Nna Tohazie yɛ ɔkofo. Nna Yaa Asantewaa yɛ ɔkofo. Ghanafo yɛ akofo. Onnyi dɛ yɛtsena hɔ na yɛdze hɛn nsa bɔ hɛn bo na yɛhwɛ ma hɛn man yi berɛ wɔ ewifo nsa ano.,
94815,"All her lamentation is, Kwame goes to meet Isaac and dies suddenly what will happen and how will he tell his story?","Nye kwadwom nyina nye dɛ, Kwame bohyia Isaac na owu mpofirmu ebɛnadze na obesi na ɔbɛyɛ dzɛn aka n’asɛm?",
96506,"Looking at the exchange rate between the dollar and the Ghana cedi, 1 dollar is equivalent to 11 Ghana cedi, and there are projections that the cedi will depreciate further.","Ehwɛ nsesa anodzen a ɔda dadar (dɔɔla) na Ghana sisi ntamu a, dadar (dɔɔla) 1 nye  Ghana sisi 11 yɛ pɛr, na ehwɛ a ihu dɛ sisi no bɛsan akɔ famu bio.",
74366,Many people are being discharged from hospitals after recovering from the coronavirus .,Hom yi nyimpa pii efi ayaresabea ber a hɔn ho atɔ hɔn wɔ coronavirus yarba ho no.,
95586,Although they make enquires between the families if there is any disease but this enquires is not what we are going to talk about now.,"Ɔwɔ mu dɛ wɔyɛ nhwehwɛmu fa ebusua ahorow no ho dze hwɛ dɛ yarba bi wɔ mu dze, naaso nnyɛ dɛm nhwehwɛmu no na yɛrebɛkasa afa ho seseiara.",
74397,Mariam has a good heart and wants the best for the people.,Mariam wɔ akoma pa na ɔpɛ dɛ nyimpa nya dza oye sen biara.,
74222,It is far better to be free to govern or misgovern yourself than to be governed by anybody else.,Ɔyɛ papa koraa dɛ wubenya ahofadzi edzi tum anaa ndzi wo ho do wɔ ɔkwan a papa do sen dɛ obi fofor biara bodzi wo do.,
75271,The district budget was approved in the absence of some councillors.,Wɔgyee mansin no ne sikasɛm ho ntotoe no too mu ber a abaguafo no nnyi hɔ,
76228,"While the reasons for this disparity aren’t clear, risk factors for stroke include high blood pressure, diabetes, sickle cell anemia, smoking, and obesity—all conditions that are prevalent among Africans.","Ber a siantsir a nsosoree aba no enyim nnda hɔ no, dza ɔdze ndwedwee yarba ba no bi nye bɔgya mbordo, esikyire yarba, sekel sɛɛl bɔgya mu yarba, wiinom, na kɛseyɛ mbordo- ne nyinara yɛ ɔhaw a ɔda edzi wɔ Ebibirmu.",
96494,"To ensure that young people acquire proper guidance and understanding of customs and values, it is crucial to incorporate teachings on these principles in schools, public spaces, media platforms such as television and radio, as well as within households.","Mbrɛ ɔbɛyɛ a mbabun benya ntsentsenee na ntsease wɔ amambra na abrabɔ pa ho no, ohia dɛ yɛyɛ iyi ho nkyerɛkyerɛ nhyehyɛɛ yi wɔ skuul, baguamu, miidia prama ahorow bi tse dɛ tɛlɛbihyɛn na redio, nna fidua mu so.",
94756,"Research shows that 1.7 million people are diagnosed with breast cancer each year, and 522,000 of them lose their lives that year.","Nhwehwɛmu kyerɛ dɛ nyimpa ɔpepem 1.7 na wonya nufu mu kokoram yarba afe biara, na hɔn mu 522,000 hweer hɔn nkwa wɔ dɛm afe no mu.",good
75341,"The district should proactively establish programs for single mothers, providing essential support and resources to empower them and ensure their well-being and success.","Otwar dɛ mansin no keka hɔn ho yɛ dwumadzi ma abaatan a hɔn nkotsee na wɔhwɛ hɔn mba, wɔyɛ hɔn mboa dze hyɛ hɔn dzen hwɛ dɛ hɔn asetsena mu nsɛm kɔ yie na woedzi konyim",
74806,Religious leaders are responsible for imparting good morals into the youth.,Ɔsom mu mpanyimfo ahorow no nye nkorɔfo a wɔdze ndzeyɛɛ papa su hyɛ mbaabun mu.,
95290,Akan is a Niger-Congo language group which is the native language of the people of Akan in Ghana.,Akan yɛ Niger-Congo kasa kuw a ɔyɛ kasa a Akanfo a wɔwɔ Ghana ka.,
75329,The district officials will arrest farmers who disobey the imposed quarantine.,Mpanyimfo a wɔwɔ mansin no mu no bɛkyekyer ekuafo a wonndzi nhyehyɛɛ a ɔbɔboa abɔ eduadzewa ho ban no,
95396,"Some of their towns are Bekwai, Pampaso, Takyiman, Dwaben and Dwaaso.","Hɔn nkuronkurow no binom nye Bekwai, Pampaso, Tekyiman, Dwaben na Dwaaso.",
96436,Researchers have shown that drinking water reduces the amount of glucose in the body and protects against diabetes as water is full of nutrients like Vitamin and others,Nhwehwɛmufo ada no edzi dɛ enom nsu a ɔtsew esikyire dodow a ɔwɔ nyimpadua no mu no do na ɔbɔ ho ban fi esikyire-yarba ho dɛ mbrɛ edzibandur bi tse dɛ Vitamin ahyɛ nsu mu ma no.,
73922,Also priests get transferred from one parish to another.,Wɔdze asɔfo kɔ mbeambea ahorow.,
75192,The community groups are a source of extra income to farmers.,Borɔn ekuwekuw no yɛ bea a mfaso pii wɔ ma ekuafo.,
75783,The sub counties will receive income to properly plan for the people.,Aman nkumaa no benya mfaso na woetum atoto ndzɛmba yie ama ɔmanfo no.,
94458,This is what happens in anyone who has not had a blood clot.,Iyi na osi wɔ obiara no mu a onnya mbogya ntoa ntoa.,Iyi na osi wɔ obiara a no mbɔgyaa na ne ntsin mu nnsisiwii mu.
75558,The leaders explained that the rewards would only be given to the top performers.,Akandzifo no kyerɛɛ mu dɛ abawdobɔdze no bɔkɔ ama hɔn a wɔbɔbɔ hɔnho mbɔdzen no nkotsee.,
73860,Abena added that seeds are being grown over night and eaten the next day.,Abena so dze ka ho dɛ wodua nduadzewa anadwe twa no da a odzi do no.,
74229,It is the headteacher's role to keep students safe while at school.,Ɔyɛ ɔkyerɛkyerɛfo panyin no dzibew dɛ ɔbɛma esuafo enya ahobambɔ ber a wɔwɔ skuul mu no.,
75077,"Taxes should be paid in the bank, emphasizing the proper payment method for taxes.","Otwar dɛ tow wotua wɔ sikakorabea, ritsi ntuae mapa kwan ma tow no mu.",
94697,"To these words Mama Pat replied that she had not defrauded anyone, but that all the money brought by her congregation members was a sacrifice from their own hearts.","Dɛm nsɛm yi no Mama Pat buaa dɛ ɔasisi obiara, nanso sika a n’asafo no mufo dze brɛɛ no nyina yɛ afɔrebɔ a efi hɔn ankasa koma mu.",good
95042,"He explained that he was admitted at the Kotoku hospital where he was receiving treatment, but unfortunately he could not make it and has left the world of the living so painfully.","Ɔkyerɛɛ mu dɛ wɔgyee no too Kotoku asopitsi a nna ɔregye apɔwmudzen wɔ hɔ, naaso oeentum ennya ne fahodzi na ofii wiadze yi mu yayaayaw.",
94999,"I know her death will touch the heart of citizens, countries and all people surrounding us in the world.","Menyim dɛ ne wu no bɛhye ɔmamfo, aman na nyimpa dodow a woetwa hɛn ho ehyia wɔ wiadze yi mu.",
75760,The senior accounts assistant was greatly rewarded for his efficiency and effectiveness.,Wɔbɔɔ nkontaabufo abedziekyir panyin no abaw do kɛsenara wɔ no ndwuma pa ho ntsi.,
95526,"Because of this, Sipe caught Bonoman, who were not in support with his king, that if it was his wish like they have de-stooled him.","Ɔnam iyi ntsi, Sipe kyeer Bonoman, hɔn a nna wɔnntaa ne hen no ekyir dɛ sɛ ɔka n'apɛdze a nkyɛ woetu no adze do.",
95418,"Because they also want to become popular, they learn to dress in an improper ways since they know people who have become popular in the world dress that way to encourage them in life.","Osiandɛ wɔpɛ dɛ nkorɔfo tse hɔn nka ntsi, wosua mbrɛ wosiesie hɔn ho kwan bɔn dodɛ mbrɛ wonyim dɛ nkorɔfo a wɔagye dzin wɔ wiadze yi mu siesie hɔnho dɛm kwan no do dze hyɛ hɔn nkuran wɔ abrabɔ mu.",
74603,"Once you cease to be an employee, your name is taken off the payroll.","Ber a ebegyae pɛr, na woeyi wo dzin efi hɔn a wotua hɔn kaw no do.",
74011,"Being that headteacher is away, the deputy is in charge.","Dɛ kyerɛkyerɛnyi panyin no nnyi hɔ no,n'abadzi ekyir na ɔwɔ hɔ.",
96453,"Then, Father Nkonto decided that, since the animals had eaten his cocoyam and nothing happened to them, he too would train some to make bread just as he used to make bread with sticks.","Nna Egya Nkonto faa adwen dɛ, dɛ mbrɛ mbowa no edzi ne mankanyi no a hwee annyɛ hɔn no, ɔno so bɛtsetse nkorɔfo ma wɔaayɛ paanoo tse dɛ mbrɛ ɔmaa wɔdze mbaa yɛɛ paanoo no.",
94794,"A mother who has given birth, please make time for your baby so that he does not drink the water properly.","Nã a wawo, yɛserɛ dɛ nya ber ma w'abɔdomaba no mbrɛ ɔbɛyɛ a ɔnnom nsu no yie.",please recheck the sentence again... Thanks
94920,"This is used to tell the victim that now that he is an adult, he must make it a point to live like a mako.","Wɔdze iyi ka kyerɛ dza wɔayɛ no bɔn no dɛ afei a wayɛ ɔpanyin no, ɔwɔ dɛ ɔma ɔyɛ nye tsirmu dɛ ɔbɛtsena ase tse dɛ maako.",
75718,The process will benefit farmers because food crops have got a ready market.,Nhyehyɛɛ no bɔboa ekuafo no osiandɛ nduadzewa no enya hɔn gua dada.,
94547,This made the Bono people very wealthy and people from all over the country and even other countries weighed their money in the Bono city,Iyi ma Bonofo bɛyɛ sikafo na nkorɔfo fi ɔman no beebi ara na mpo aman fofor susu hɔn sika wɔ Bono Kurow kɛse mu.,good
73964,Are you following the right measurements when planting?,Ana iridzi kwan pa wɔfa do dze dua nduadzewa n'ekyir a?,
96621,"While running, the person will be looking for a place to lower the rag behind one of the people who have bent down.","Ber a orutu mbirika no, nyimpa no hwehwɛ beebi na ogyaa kar no to nkorɔfo no a wɔakotokotow no mu kor n'ekyir.",
96711,"Mr Ofori-Atta further explained that, the American dollar has appreciated which has affected other foreign currencies like Yen, Pound and Euro","Owura Ofori-Attah kyerɛɛ mu dɛ, America dadar (dɔɔla) no ama no mu do na enya nsunsuando wɔ sika ahorow bi tse dɛ Yen, Pound na Euro.",
74716,"People in the community, armed with bows and arrows, killed the hippopotamus that had chased down the locals and bitten their legs in the morning hours. It was finally killed in the afternoon.","Nyimpa a wɔwɔ kurom hɔ a wɔde egyan na egyan ahyɛ hɔn ho no, kunkum suson a nna wɔtaa apaa mu hɔfo no na wɔkeka hɔn anan anapa ber mu. Ewiei koraa no wokum no ewiaber.",
75040,Students are encouraged to help each other whenever there is a need.,Wɔahyɛ esuafo nkuran dɛ wɔmboa hɔnho hɔnho aber biara mu a ohia mboa.,
96003,"Your culture defines who you are; therefore, it's important to treat it seriously.",W’amambra na ɔkyerɛ nyimpa a eyɛ ntsi oyɛ dɛ ibɔhwɛ no yie,
76079,"Through culture, I can prepare my children for a successful future.",Menam amambra do botum aboa me mba ma woeenya daakye papa.,
96196,"He realized that if the washing would get in his way in his dreams, he could use his face and some of his body parts to make her laugh without opening his mouth.","Ohun dɛ sɛ adzehor no besiw n'adaaso no akwan a, ɔno obotum dze n'enyim na no hanam akwaa no bi eyi paserew a onnkobue n'ano.",
96483,All young girls willingly participate in the menarche rituals as a way to bring honor and glory to their families and increase their chances of finding a suitable suitor for marriage.,Mbabaawa nyinara dze hɔnho hyɛ brayɛ a odzi kan no mu atɔrmuadze no mu dɛ kwan a wɔdze kamfo na hyɛ ababaawa na n'ebusua enyimyam na ɔma akwangya a ɔma hɔn ba no nya ɔhokafo pa wɔ awar mu.,
76085,"To address the situation, the committee imposed a ban on livestock movement during the night, aiming to curb theft and illegal activities.","Mbrɛ ɔbɛyɛ a wɔbɔsɔw ɔhaw no ano no, abaguafokuw no abra nyɛmbowa a woduadua kurom anafua, hɔn enyidoadzehu nye dɛ wobesiw adzewia na dwumadzi ahorow a otsia mbra ano.",
94986,"If we are to consider things well, we would know that he has done so well.","Sɛ yɛka dɛ yɛrohwɛ ndzɛmba bi a, yebohu dɛ ɔaayɛ adze papa.",
