id,text,label,Unnamed: 3
74902,She volunteered at the local shelter to assist in the care and feeding of the orphans.,Otuu noho sii hɔ wɔ borɔn mu tsenabea hɔ dze boa ngyanka no hɔn hwɛ na hɔn edzibanma mu.,
75233,The council needs data about the possible new sources of revenue.,Abaguafo no hia nsɛm a ɔfa kwan fofor a wɔbɛfa enya sika,
74048,Burkina Faso is a neighboring country to Ghana.,Burkina Faso yɛ ɔman a ɔnye Ghana bɔ hye.,
75994,There were more COVID-19 cases from Eastern Ghana at the end of September.,,
76103,"Trade between Akan kingdoms and the Mossi kingdoms to the north flowed through their homeland, subjecting them to Islamic influence, and to the depredations of those more powerful.","Eguadzi a ɔkɔr do wɔ Akanfo ahendzi na Mossifo ahendzi ntamu mu no fi etsifi do noho bɛfaa hɔn amanse, iyi maa Nkramosom menyaa hɔn do nhyɛdo, na wɔhyeew hɔn nkorɔfo a wɔwɔ ahoɔdzen nyinara.",
96094,"Additionally, people build dwellings inside the farm so that they can live there and keep the farm safe from thieves.","Bio, nkorɔfo bɔ asese wɔ hɔn kwa mu ama woeetum atsena mu abɔ kwa no ban efi ewifo ho.",
75074,Talents can be a good way to get the youth out of poverty.,Adom akyɛdze botum ayɛ kwan pa a oyi mbabun fi ohia mu.,
94289,"However, doing so prevents the food from being metabolized in the body, and it takes a long time for the food to break down.","Mbom, dɛm ndzeyɛɛ yi siw edziban no kwan ma onntum nnyɛ n’edwuma wɔ honamdua no mu, na iyi gye mber tsentsen ansaana edziban no edzi no dwuma a otwar dɛ odzi no wɔ nyimpadua no mu no.",
73994,Authority to apprehend anyone who doesn't keep law and order.,Mpanyimfo a wɔwɔ tum no bɛkyer obiara a onndzi mbra na nhyehyɛɛ do no.,
75808,The teacher said it was awkward to share toilets with students.,Kyerɛkyerɛnyi no kaa dɛ onntwa yie dɛ ɔnye esuafo no bɔkɔ egyananbea kor do.,
75696,"The predominant fauna or food rich wildlife and animal species encountered in the Ashanti Empire were the hen, sheep, goat, duck, turkey, rabbit, guinea fowl, fish, and the porcupine.","Mbowadoma anaa hamu mbowa a edziban ayɛ hɔn ma na mbowakuw ahorow yehunii wɔ Esuantseman mu nye akokɔ, ogua, apɔnkye, dɔkɔdɔkɔ, krakun, asoaso, akɔnfɛm, nsumunam na kɔtɔkɔ no.",
74345,Mankessim has a high increase in the number of COVID-19 cases.,Mankessim wɔ enyim kɛse wɔ nyimpa dodow a hɔn enya COVID-19 mu.,
75008,Some youths participate in sports betting expecting to win big money.,Mbabun binom dze hɔnho gye agodzi kyakya mu wɔhwɛ kwan dɛ wobedzi sika kɛse.,
95316,"He explained that, if the chiefs and the corporate do not know anything about this they couldn't have destroyed the lands like they have done, and they even pushed in more into the practice.","Ɔkyerɛkyerɛɛ mu dɛ, sɛ mpanyimfo na edwumakuw no nnyim iyi ho hwee a nkyɛ worunntum nsɛɛ nsaase no dɛ mbrɛ wɔayɛ no, na mpo wopiaa pii kɔɔ adzeyɛ mu.",
75905,The youths blamed leaders for denying them chances of benefiting from the government programs.,Mbaabun no bɔɔ abaanodzifo sombo dɛ wɔmma hɔn kwan ma wonnya aban no ndwuma ahorow mu mfaso.,
75106,The activity was to remember the missionaries who introduced Christianity in Ghana.,Dwumadzi no nna wɔdze rekaa asɔfo a wɔdze Kristosom bɔbɔɔ adze wɔ Ghana.,
76229,"Whiles Gbewaa was still alive, his daughter Yennenga, travelled north and founded the Mossi Kingdoms, who constitute the majority of present day Burkina Faso.","Ber a nna Gbewaa da ho tse ase no, ne ba baa Yennenga tuu kwan faa etsifi afamu na ɔkɛkyekyeer Mossi Ahenkurow no, hɔn na wɔdɔɔ so wɔ ndɛ mber yi Burkina Faso.",
74190,"If I hold her hand she says, Don’t touch! If I hold her foot she says Don’t touch! But when I hold her waist-beads she pretends not to know.","Sɛ mokitsa nye nsa a ɔka dɛ, Monfa wo nsa nka! Sɛ mokitsa nye nan a ɔka dɛ Monfa wo nsa nka! Nanso sɛ mokitsa n’asen-arenye a ɔyɛ nye ho dɛ onnyim.",
96686,"He said; ""we are striking because, we seeing some people working who are supposed to be on retirement","Ɔkaa dɛ, ""yɛretsew etua osiandɛ, yeruhu nkorɔfo bi a wɔreyɛ edwuma a nkyɛ ɔwɔ dɛ wɔapon.",
74876,She is allergic to certain smells and could not tolerate the smell from her shoes.,Okyir nka binom na oenntum enngyina no mpabowa mu nka no.,
74029,Both the public and the private sector provide employment.,Ɔman na ankorankor ndwuma nyina ma ɔmamfo edwuma.,
74067,Childbearing is the process of giving birth to children.,Awoo yɛ kwan a wɔfa do wo mbofra.,
76133,Various health organizations have come up to help in boosting maternal health.,Apɔwmudzen edwumayɛkuw ahorow pii na woeyi hɔn tsir dze roboa adwen mu haw ho ayarsa.,
74158,"His father did not live with the family, but worked in Half Assini where he pursued his goldsmith business until his death.","N'agya annye n'ebusuafo anntsena, mbom ɔyɛ edwuma wɔ Half Assini hɔ na ɔtsenae yɛɛ ne sika kɔkɔɔ edwuma kapem dɛ owui.",
95080,"For that, they believed that maybe the child is in the pit full of water.","Ɔnam dɛm ntsi, wɔgye dzi dɛ ebia abofra no wɔ amuna no a nsu ahyɛ mu ma no mu.",
95785,"He stated that without education, we cannot move from being a developing country to a developed country.",Ɔkaa dɛ yennkotum efi bea a yɛwɔ yi wɔ mpontu mu akɔ hɛn enyim a nwomasua nnka ho,
76003,"These days, the youths have been trained in various money making skills.",Ndɛ mber yi wɔama mbabun ntsetsee afa akwan ahorow a wɔfa do nya sika ho.,
94326,"Their kidneys can turn dark, and scars can come out. The kidney surface of those with kidney problems can change to dark as shown in the picture on the left.","Hɔn Berɛbo dan tuntum,na kãm pue mu. Berɛbo enyim wɔ hɔn a wɔwɔ kokoram yarba tum sesa yɛ tuntum tsedɛ ma yɛhu wɔ mfonyin nomu wɔ wo bankum.",
96107,"What has been added is that many roadways now include signs for drivers, passengers, and pedestrians because of technology and newly constructed roads.","Dza wɔdze aka ho nye dɛ ndɛ akwampae ahorow dze nsɛnkyerɛdze ka ho ma ahɛnkafo, ahɛntsiafo na kwan ho nyimpa osian mfir na akwan afofor a aba no ntsi.",
95287,"On September 4, 2022, Bolingo introduced online news called the Akan Kaseɛbɔ (www.akannews.com) in two Akan dialects : Asante Twi and Mfantse.","Fankwa 4,2022, Bolingo daa abɛɛfo ntetan do amandzɛɛbɔ a wɔfrɛ no Akan Kaseɛbɔ(www.akannews.com) wɔ Akan kasa ebien mu: Twi na Mfantse.",
75611,The Mole-Dagbon Kingdoms are the earliest political kingdoms of Modern Ghana.,Mole-Dagbon ahenman ahorow no nye Abaɛfor Ghana amanyɛ ahenman a wodzi kan.,
96156,"In 1961, Dr. A.S. Ebenezer Ako-Adjei also became the first Minister in Ghana's history to be in charge of Ghana's foreign relations.","Afe 1961 mu no, Okunyin  A.S. Ebenezer Ako-Adjei sanee bɛyɛɛ Ɔsoɛfo a odzi kan wɔ ɔman no abakɔsɛm mu a ɔhwɛ ɔman no nye amanaman ntamu nkitahodzi do.",
75335,The district provided tree seedlings to the people who cut doown trees to obtain timber.,Mansin no maa hɔn a wotwitwa ndua no dua n’aba ma eonya timba dua,
75787,The superior quality of a product is evident in its durability and performance.,Edwinsa bi ne papayɛ abɔso da edzi wɔ ne kyɛr na no dwumadzi mu.,
75172,The Christians believe this is a once in a lifetime opportunity.,Kristosomfo no gye dzi dɛ iyi yɛ kor pɛ wɔ abrabɔ mu akwanya.,
74484,More apartments should be constructed due to the growing population.,Ɔwɔ dɛ wosisi adan pii esian nyimpa a wɔredɔɔso ntsi.,
76192,"We wrote a long shopping list, preparing for our upcoming shopping trip.","Yɛyɛɛ adzetɔ nhyehyɛɛpon tsentsentsen, yɛreyɛ ahoboa atweɔn hɛn adzetɔ akwantu.",
94391,High levels of these homositein and amino ased levels are said to be associated with heart disease.,Homositein na amino acids a ɔwɔ sorsor no nye akoma yarba nam.,good
73981,Asarebea entered her first ever beauty contest when she was five years.,Asarebea wuraa ahoɔfɛw akansi no mu wɔ mfe enum a odzi kan wɔ n'abrabɔ mu.,
96716,"Even if it happens to be like that, nobody can hide the happy news hidden in the Adinkra symbol which exceeds the normal and spiritual understanding","Mpo sɛ ɔba no dɛm a, obiara nnyi hɔ a obotum dze enyigyesɛm a wɔdze esie wɔ Adinkra no mu no a ɔbor enyido na sunsum mu ntsease do no esie.",
75061,Successful illiterate businessmen are the reasons why some parents don't take children to school.,Annkɔskuulfo edziyie edwumayɛfo nye siantsir a awofo binom mmfa hɔn mba nnkɔ skuul.,
74221,It is commonly known that exercise is beneficial for overall health.,Wɔtaa nyim dɛ Apɔwmutsentsen wɔ mfaso ma apɔwmudzen nyinara.,
95863,"Over the years, it has changed and experienced various seasons.","Mber pii etwa mu kɔr no, asesa na ɔdze tsebea ahorow aba",
94341,"Instead, children living in urban areas and those with wealthy parents are more likely to attend primary, secondary and high school for it even above the state requirements.","Mbom, mbofra a wɔtse kurow kɛse mu na hɔn a w'awofo yɛ adzefo wɔ akwannya dɛ wɔkɔ ahyɛse skuul, ntoado skuul na skuulpɔn mpo bor dza aban hwehwɛ fi hɔn hɔ.",good
75592,The medical and the newspaper team are running health adverts this week.,Kuw a wɔhwɛ ndursɛm na dawurbɔkrataa reyɛ apɔwmudzen ho dawurbɔ dapɛn yi mu.,
74730,People want to practice farming but they do not have enough land to do so.,Nkorɔfo pɛ dɛ wɔyɛ ekuadwuma naaso wonnyi asaase pii a wɔdze bɛyɛ.,
75565,The local chairperson gives the seeds to the people well known to him.,Apaamu hɔ guamutsenanyi no dze aba no ma hɔn a onyim hɔn paa.,
96558,This is not the first time Ghana and other African countries have been barred from travelling to Dubai.,Iyi nnyɛ dza odzi kan a ɔbra Ghana na Ebibiman mu bi dɛ mma wɔnnkɔ Dubai .,
74426,Members of parliament should attend important tax meetings.,Ɔwɔ dɛ mbrahyɛbaguafo kɔ towtua ho nhyiam ahorow a ɔho hia.,
76179,We should turn to Christ during this hard time of the pandemic.,Yɛnkɔ Christ nkyɛn wɔ mber a ɔyɛ dzen wɔ yardɔm yi mu yi.,
95624,"Or will you be happy to get married, when your genotypes doesn't meet and because of that your children are passing through pains and sickness everyday and others to are dying.","Anaa oenyi begye dɛ ebɔwar, ber wo ""genotype"" no nnhyia na ɔnam dɛ wo mba no refa ɔhaw na nyarba mu dabiara na binom so ruwu.",
75767,The status of the health sector will be discussed live on television.,Wobedzi apɔwmudzen asoɛe no tsebea ho nkɔmbɔ wɔ tɛlɛbihyen do.,
75532,"The kingdom has a diverse selection of foods. Common foods are Sa-am (Tuozaafi), Sakoro (pounded yam), Tuya (rice and beans), Tubani, Gablee, wasawasa, yaankahanda, yaanmonda, yaankikalli, and others.","Kurowpɔn no wɔ edziban ahorow pii, tuozaafi, sakoro, tuya, tubani, gablee, wasawasa, yaankahanda, yaanmonda, yaankikalli na pii a ɔkeka ho",
76126,Use of contraceptives helps families to lay prospective strategies for their children.,Nyinsen anosiw edur ne mfae boa ebusua ahorow ma wɔdze nhyehyɛɛ papa gu akwan mu ma hɔn mba.,
94513,"These products contain mono-sodium glutamates, which are very healthy","Dɛm ndzɛmba yi wɔ mono-sodium glutamates, a apɔwmudzen wɔ mu yie.",good
94389,"Furthermore, the fiber content of grapes is very high so it helps to soften the stomach capacity to prevent asthma.","Bio,fibre a ɔwɔ grapes mu no ma yefun nomu gow ma osiw ntsihyiwa ano.",good
74183,"I have always wanted to ride a horse. Of course, I don't know how to, but how hard can it be? You just sit and instruct it to move.","Ber nyina na mepɛ dɛ metsena pɔnkɔ do. Nokwar, minnyim mosea moyɛ, nanso obotum ayɛ dzen dzɛn? Wotsena ase kɛkɛ na wokyerɛ no dɛ ontu.",
75546,The land will be inspected to check for feasibility to build a park.,Wɔbɛyɛ nhwehwɛmu wɔ asaase a wobesi prama no wɔ do no ho ahwɛ dɛ obɛyɛ yie a,
95750,"He indicated that during the past month, discussions were held with these agencies in detail.","Ɔkyerɛɛ dɛ abosoom a abɛsen etwa mu no, nkitsahodzi bi dzii kan kɔr do",
75958,There is a rise in theft and killings in the rural parts of the country.,Adzewia na nyimpaku akɔ sor wɔ ɔman yi no nkurase mu.,
76151,"Vocational skills are important in our lives, recognizing the significance of practical skills for personal and professional development.","Nsaano dwuma ho nyimdzee ho hia wɔ hɛn abrabɔ mu, ɔma yehu dwuma a yedzi dze boa hɛnarankasa na edwumasɛm ho mpontu ho mfaso.",
95735,"There would not be any hampers in 2022; Districts, Municipalities and other governmental institutions are not going to issue journals, calendars or any publicity materials for 2024.","Wɔnnkɛma akyɛdze biara afe 2022 mu;Mansin akɛse na nkakramba nye aban edwumakuw no remma Journals, kalɛnda na ndzɛmba  biara afe 2024",
96083,He can also display a board with text on it to inform people that he is the owner.,Obotum so dze pon bi a akyerɛw wɔ do esi hɔ akyerɛ nkorɔfo dɛ ɔyɛ nedze.,
96546,"Lawyer Alfred Tuah Yeboah stated, ""During our last sitting, the Attorney General indicated that all his documents are ready for prosecuting. Now, he is pleading for extra days. ""I am pleading that you allow her to go home until our next sitting here in the court.""","Mbranyimfo Alfred Tuah Yeboah kaa dɛ, ""Hɛn asetsena a odzi ewiei no, Ɔtsɛmbuafo Panyin kyerɛɛ dɛ ne nkrataa nyinara ayɛ krado a ɔdze bɔbɔ kwaadu. Seseiara, ɔrepa kyɛw dɛ wɔmma no nda kakra. 'Mereserɛ hom dɛ hom nngyaa no ma ɔnkɔ fie nkodu asetsena odzi hɔ wɔ asɛmdzibea.",
95474,This kente talks about the Akans demoncracy.,Dɛm kente yi kasa fa Akan kabi-ma-menka-bi ho.,
95744,"He stated that comparing the cost of oil to the amount of gold the country obtains every month, there is no doubt that we can do this.","Ɔkyerɛɛ dɛ sɛ wɔdze fangow no bo toto sikakɔkɔɔ a a ɔman no nya no bosom biara a, egyingye biara nnyi ho dɛ yennkotum ayɛ iyi",
96537,"Let's now explore the roles of the subchiefs at the palace. Among the close set of the King is the Queenmother, who holds a significant position and offers relevant advice at appropriate times. Her counsel is highly regarded and plays a crucial role in the governance and decision-making processes of the kingdom.","Sesei ma yɛnhwɛ ahemfo nkaa no hɔn dwumadzi wɔ ahemfie. Nyia ɔbɛn ɔhen no paa nye ɔbaahembaa, ɔno a odzi dzibew a ohia na ɔma afotu a no hia wɔ ne ber pa mu. N'afotu ho hia papaapa na odzi dwumason wɔ amambu na egyinasi mu wɔ ahenkurow no mu.",
95330,"The director of the COCOBOD association, Mr Peter Mark Manu when presenting, made it known that the arrangements of the pension fee for the cocoa farmers that they are bringing would start from this month.","Ber a COCOBOD kuw kwankyerɛfo Owura Peter Mark Manu rekasa no, nhyehyɛɛ a wɔdze egu akwan mu ama kokoo ekuafo hɔn pɛnhyen a wɔdze reba no bɛhyɛ ase wɔ dɛm bosoom yi mu.",
95882,What are the symptoms of constipation?,Ayamutsim no ho nsɛnkyerɛndze nye dɛn?,
95269,The Eastern Regional member of Parliament Seth Kwame Acheampong has made it known that currently they are building seven hospitals in the various districts in the region dua to their 111 project.,Epuei Mantɔw mbrahyɛbaguanyi Seth Kwame Acheampong ama yɛatse ase dɛ seseiara worisi asopitsi esuon wɔ amansin ahorow  no mu wɔ mantɔw no mu ɔnam hɔn 111 dwumadzi no ntsi.,
95537,"since Bafo Pem was afraid that the of Bono will be taken off the throne, he gave them gods, that is , they spilled their blood into water to be taken by all.","Dɛ mbrɛ nna Bafo Pem nna osuro dɛ wobotu Bonohen no adze do no, ɔmaa hɔn sikakɔkɔɔ, ɔno nye dɛ, wotuu hɔn mbɔgyaa guu nsu mu dɛ hɔn nyinara wɔnnom.",
74202,"In its actual workings, however, it had various shortcomings. Its humanist impulse, nevertheless, is something that continues to urge us towards our all-African socialist reconstruction.","Nanso, wɔ nye dwumadzi ankasa mu no, na ɔwɔ sintɔ ahorow. Nye nyinara mu no, nye nyimpa ho adwen no, yɛ biribi a ɔkɔ do hyɛ hɛn nkuran dɛ hɛnkɔ hɛn Afrika nyinaa asetsena mu sankɔhwɛ no do.",
96256,Often it is seen on it alone even with a rash because of the size and severity of the mouth.,Wɔtaa hu ɔno nko wɔ do ber mpo a ɔfom rokɔ do ɔnam ano no ne kɛse na n'anodzen ntsi.,
76093,"To mitigate deforestation, the government has implemented strict rules to prohibit the cutting down of trees, while local leaders have urged the community to conserve the environment.","Mbrɛ ɔbɛyɛ a kwaasɛɛ do botwa no, aban ayɛ nhyehyɛɛ ketsee a ɔbra ndua no ntwae, ber a nkurow do banodzifo no aserɛ kurow no dɛ wɔmmbɔ hɔn atsenae ho ban.",
75138,The capacity of passengers was limited to control the spread of coronavirus .,Wɔtseew ahɛnkafo dodow do ma wɔdze hwɛɛ COVID-19 ne ntserɛwee do.,
75764,The skillful musician played the piano with incredible precision and passion.,Sankubɔfo nwanwanyi no dze pɛpɛɛpɛyɛ na ayamuhyehye soronko bɔɔ sanku no.,
94623,"From there, he headed to the Police Station in Asankragua to write his statement.","Fi hɔ no, ɔkɔr Polisifo akakye  wɔ Asankragua kɔ kyerɛw n'enum asɛm.",good
74948,Some mothers want to go to hospital when they start feeling contractions.,Maamenom binom pɛ dɛ wɔkɔ asopitsi ber a wɔhyɛ ase nya atsenka dɛ han ase ebue a.,
95300,"It would also help the make the work of the language meaningful, and we getting the important words in our own language on the internet to grow.","Ɔbɔboa so ma kasa n'edwuma no ayɛ ma nteasee wɔ mu, na yenya nsɛmfua a no ho hia wɔ hɛn ankasa hɛn kasa mu wɔ intanɛt do ama enyin.",
75248,The current pandemic situation has made many people postpone their marriage ceremonies.,Nsaayarba a aba ndɛ yi ama nkorɔfo etu hɔn awargye ahyɛ da,
95512,I believe that you have learn something today.,Megye dzi dɛ esua biribi ndɛ.,
75817,The teachers feared to meet pupils in the toilets.,Akyerɛkyerɛfo no suroo dɛ wobehyia esuafo no wɔ egyananbea no do.,
73874,Activities cannot take place in poor weather conditions.,Ndzeyɛɛ bi nntum nnkɔ do wɔ tsebea bɔn mu.,
96103,"In the past, a person wore a black or red cloth when they were mourning or in a serious situation. Things have changed now.","Nkan no, obi fura tuntum anaa kɔkɔɔ ber ɔwɔ awerɛhow anaa enyiber tsebea mu. Ndzɛmba asesa seseiara.",
94764,"Then you can feel pain in your breasts, you start to feel pain in your breasts too take action, don't think it's just painful and it doesn't stay on your shoulders.","Afei ibotum atse yaw wɔ wo nufu mu, ihyɛase tse yaw wɔ wo nufu mu nso a yɛ ho biribi, nsusu dɛ ɔyɛ yaw kɛkɛ na ɔnntsena hom batsir do.",good
75035,Stroke impacts Africans more than any other racial group.,Edwuma fietsenae nya nsunsuando wɔ Ebibifo do kyɛn nyimpasu nkaa biara.,
94653,Finance was thought to be the only barrier between breast cancer and treatment.,Nna wosusuw dɛ sikasɛm nkutoo nye akwansidze a ɔda nufu mu kokoram na ayarsa ntamu.,good
94910,One ancient culture that our ancestors took seriously was bragging.,Tsetseberdo amambra kor a na hɛn nananom mfa enyibersɛm nye ahohoahoa.,
95394,The king of Nsuta Nana Amankwaa is thier third child.,Nsutahen Nana Amankwaa yɛ hɔn ba a ɔtɔ do ebiasa.,
94975,"Tuchel lost all his decisions when he saw the team playing in Croatia on Tuesday evening, it was from then that he believed that the team has lost something, and he solely blamed himself for everything.","Tuchel hweer nye gyinaesi nyina ber a ohu dɛ kuw no rebɔ bɔɔl wɔ Croatia Benada ewinber, efi dɛm ber no na ogye dzii dɛ kuw no ahweer biribi, na ɔdze biribiara ho asodzi too nye ho nkotse do.",
96050,"When a hunter finds a bullet on his way to a specific part of the forest, it means another hunter has headed in that direction, so he should head in another direction.","Sɛ ɔbɔfo hu itur abobaa wɔ kwan do a, ɔkyerɛ dɛ ɔbɔfo bi edzi kan afa hɔ dada ntsi otwar dɛ ɔfa kwan fofor do",
95071,"In the news, the house had five single rooms.","Amandzɛɛbɔ no mu no, fie no wɔ adankora enum.",
96765,"Asuo Bom is a mythological creature in Fante folklore that is said to reside in bodies of water, such as rivers or lakes. It is believed to be a water spirit that can bring good fortune or misfortune to those who encounter it.",Esuo Bom yɛ ɔdomankoma abɔdze wɔ Mfantsefo kodzisɛm mu a wɔkyerɛ dɛ ɔtse nsu tse dɛ nsutsen anaa nsutae mu. Wɔgye dzi dɛ ɔyɛ nsu mu nyamea otum dze ndze pa ma ndom na hɔn a ohyia hɔn no do.,
95405,"Our elders says, ones home is the most comfortable place.","Hɛn mpanyimfo ka dɛ, obi ne fie nye bea a ahotɔ wɔ.",
75415,The fund has helped many students to chase their dream career.,Sika no aboa esuafo pii ma hɔn nsa aka  edwuma a nna wɔrohwehwɛ dɛ wɔbɛyɛ no daakye,
96277,"When the person has this cut, the most obvious symptoms are frequent coughing, and nausea.","Nyimpa no nya twa yi a, nsɛnkyerɛdze a ɔda edzi paa nye wawbɔ ntaataado na abofon.",
73772,A ban was lifted on public transport due to the pandemic outbreak.,"Tabon a nna ɔda ɔman yi n’akwantusɛm do osian yarba huuhu a oyii ne tsir no, seseiara aberwa eyi poma kwan mu ma woeyi efi hɔ.",
75352,The doctor has put my mother on oxygen to support her in breathing.,Datser no ama me maame ahom dze roboa no ma oetum egu ahom yie,
96194,"They walked on, for some time, through the most crowded and densely inhabited part of the town; and then, striking down a narrow street more dirty and miserable than any they had yet passed through, paused to look for the house which was the object of their search.","Wɔkɔr do nantseew mber kakraa araa wɔ dɔm mu na kurow no ne fa a dɔm abɔ apee do no mu; na ekyir no, wɔfaa kwan bi a no do ayɛ fi pasaa sen kwan biara nna wɔafa do pɛn, gyinaa dɛ wɔrehwehwɛ dan a nna ɔyɛ hɔn adzehwehwɛ no ngyinado.",
95888,"Because the solid waste gathers and remains there for days, the person feels heaviness behind the loins and the abdomen.","Ɔnam dɛ fi no boa ano na ɔtsena hɔ kyɛr nda kakra ntsi, nyimpa no tse dɛ n’ayeradze ayɛ no dur",
75128,"The borders of present-day Ghana were realized in May 1956 when the people of the Volta region, known as British Mandated Togoland, a vote was made in a plebiscite on whether British Togoland should become part of modern Ghana.","Ndɛ mber mu Ghana ɔhye no wohunii Esusow 1956 mu ber a nkorɔfo a wɔwɔ Firaw Mantɔw mu, a wɔfrɛ hɔn British Mandated Togoland,  ambatow a wɔyɛe no nyew na oho ambatow mu dɛ British Togoland otwar dɛ wɔbɛka ndɛ Ghana ho.",
95973,"In Akanman, when someone wears scarlet or black attire, it is assumed they are in a serious situation because of the color.","Akanman mu no, sɛ obi bɔ duukuu anaa hyɛ atar tuntum a, yehu dɛ ɔwɔ asɛnyaw bi mu ɔnam ahosu no ntsi",
96346,Ask yourself what he is going to do with this piece of shoe he has stolen.,Bisa woho dɛ ebɛnadze na mpaboa fa a oewia yi ɔdze bɛyɛ.,
95505,This stands to decribe akyem group who are well trained warriors to work and protect the Asantes when mothers come there unaware.,Iyi gyina hɔ kyerɛkyerɛ Akyem kuw a wɔyɛ akofo a wɔatsetse hɔn yie dɛ wɔnyɛ edwuma na wɔmbɔ Esuantsefo ho ban ber a maamenom ba hɔ mpofirmu.,
75797,The swimmer gracefully glided through the water. He completed each stroke with precision.,Nsuborfo no toow noho wɔ nsu no mu. Oguaar ɔbortsen kor biara wɔ pɛryɛ mu.,
75990,There was an increase in prices of basic food Staples during the lockdown.,Danmuhyɛ ber no mu no Ghana edziban a ɔnnyɛ na no bo yɛɛ dzen.,
74168,Homowo is celebrated in all the cities in the Ga state with celebrations climaxing in Gamashie.,Wɔhyɛ Homowo afahyɛ wɔ nkuropɔn a ɔwɔ Nkran aman nyinara mu a afahyɛ no kɔ nye sor wɔ Gamashie mu.,
96713,"He gave them examples which include, within 2022, the country imported fish about 4 billion cedis, chicken about 1.9 billion cedis and meat about 487 million cedis","Ɔmaa hɔn mfatoho a no mu bi nye, 2022 mu no, ɔman no kraa nam a no bo som bɛyɛ sidi ɔpepepem 4, akokɔnam sidi ɔpepepem 1.9 na bɔgyanam bɛyɛ sidi ɔpepe 487.",
74836,"Sand, water and bricks are needed during the brick laying process.","Anhwea, nsu na brekese ho hia wɔ breke ntwae mu.",
94852,"Then, he put it before his officers that in order to win the war, some kings had to risk their lives","Afei, ɔdze too n'asɔfodzi mpanyimfo enyim dɛ mbrɛ ɔbɛyɛ na w'edzi nkonyim wɔ ɔko no mu no, ɔwɔ dɛ ahemfo binom wɔdze hɔn nkwa to esian mu",
75925,There are land wrangles between refugees and host communities in Northern Ghana.,Asaase ho akasakasa wɔ etukɛtsenafo na nkurow a etukɛtsenafo no kɔsoɛɛ mu no ntamu wɔ Etsifi-do Mantɔw a ɔwɔ Ghana mu..,
74590,On average how many doctors need to work in a hospital?,"Sɛ yɛrohwɛ no pɛpɛɛpɛr mu a, adatserfo ahen na ɔsɛ dɛ wɔyɛ edwuma wɔ asopitsi?",
75584,The management system has to be decentralized to every district in the country.,Woeyi ntotoe nhyehyɛɛ no efi abankɛse mu akɔ mansin biara mu.,
94324,"If there is a problem with any of these organs, we say that person has a kidney problem. The organs of the kidneys and their problems.","Sɛ ɔhaw bi wɔ dɛm honam akwaa yi ho a, yɛka dɛ dɛm nyimpa yi wɔ kokoram yarba. Kokoram akwaa na ɔhaw a ɔdze ba.",
75324,The district officials have held various meetings to discuss land conflicts.,Mpanyimfo a wɔda Mansin n'ano no edzi ehyia pii dze adwendwen basabasayɛ a wonya no asaase ho,
95819,"If we will remember, they wanted the Minister of Finance, Ken Ofori-Atta, to resign or be sacked because he could not perform his duty of managing the economy well on many occasions.","Sɛ yɛbɛkae a, nna wɔpɛdɛ nkyɛ soɛfo a ɔhwɛ sikasɛm do ,Ken Ofori Atta gyaa n’edwuma to hɔ ɔnam dɛ oenntum enndzi no dwuma yie anntoto ɔnam no mu dwumadzi yie ntsi",
