id,text,label,Unnamed: 3
96342,"Instead, there will always be hard times, anger, some yea, but try to smile a little each day before the day ends.","Mbim no, mber a no mu yɛ dzen, ebufuw bɛba na bɔ mbɔdzen dɛ ebɛserew kakra da biara ana da no akɔ ewiei.",
95428,They can talk to an elder how ever they want.,Wotum kasa kyerɛ panyin mbrɛ wɔpɛ biara.,
95923,"Akans make use of their surroundings, parts of the body and some gestures to convey meaning to other people. Before we proceed, what are symbols that speak?","Akanfo tum dze ndzɛmba a ɔwɔ hɔna tsenae, honam mfafakuwa na ndzeyɛɛ tum ka biribi a ntseasee wɔ mu kyerɛ nkorɔfo. Ansaana yɛbɔtoa do no, ebɛnadze nye nsɛnkyerɛndze a ɔkasa.",
95150,"In the news, the source of the accident is, a certain Daewoo Matiz Taxi with the number plate BA 1163-19 which was heeding towards Sunyani clashed with a certain Hyundai car with the number plate GT 2438-19 which was also heeding towards Techiman.","Amandzɛɛbɔ kyerɛ dɛ, adze a ɔdze akwanhyia no bae nye dɛ, Daewoo Matiz Taxi bi ne nɔmba ahyɛnsewdze nye BA 1163-19 a nna ɔrokɔ Sunyani a ɔnye Hyundai kaar bi ne nɔmba ahyɛsewdze nye GT 2438-19 a no so rokɔ Techiman.",
76051,This is the saddest day in our nation's history.,Ndɛ yɛ awerɛhow da kɛse wɔ hɛn man yi n'abakɔsɛm mu.,
94370,"Research has shown that eating mangoes can help the body fight certain diseases such as heart disease, diabetes and certain cancers that can affect the body.","Nhwehwɛmu akyerɛ dɛ ebedzi mango botum aboa nyimpadua no ma wakõ nyarbanyarba bi tse dɛ akõma yarba, esikyire yarba na akisikur mu bi a otum haw nyimpadua no.","Nhwehwɛmu akyerɛ dɛ idzi mango a obotum aboa nyimpadua no ma akõ nyarbanyarba bi tse dɛ akõma yarba, esikyire yarba na yamukur mu bi a otum haw nyimpadua no."
95931,The above image is called Sankofa. What this symbol found on a linguist staff seeks to tell the Akan people is the idea that they have abandoned many crucial elements of their culture and history and that they must recapture these elements in order to improve their quality of life.,Dza ɔwɔ sor ha yi na wɔfrɛ no akomfowa. Dza yehu wɔ akyeampoma yi do kasa kyerɛ Akanfo dɛ ɔatoto ndzɛmba etsitsir bi a ɔwɔ hɔn amambra mu na hɔn abakɔsɛm mu no adze na otwar dɛ wɔsan kɛfa dze boa ma abrabɔ tu mpɔn,
95642,"Note thar, children mostly get their resource blood from their fathers, either positive or negative.","Hyɛ no nsew dɛ, mboframba taa nya hɔn mbɔgya fi hɔn Papa hɔ, dɛ ɔyɛ pɔsitif anaa nɛgɛtif.",
95200,She told me all that the man did to her at that very moment.,Ɔkaa biribiara a Papa no dze yɛɛ no dɛm ber no kyerɛɛ me.,
75948,There is a meeting for the non-teaching staff whiles the organization staff are responsible for distributing food to the refugees.,Edwumayɛfo a wɔnnka akyerɛkyerɛfo no ho no wɔ nhyiamu ber a hɔn a wɔhwɛ yɛ edwuma no ho ntotoe no so hɔn asɛdze nye dɛ wɔkyɛ edziban ma etukɛtsenafo no.,
74196,"In 1951, the CPP created the Accelerated Development Plan for Education. This plan set up a six-year primary course, to be attended as close to universally as possible, with a range of possibilities to follow.","Wɔ afe 1951 mu no, CPP yɛɛ Nkɔdo Nhyehyɛɛ a Ɔayɛ no Ntsɛmntsɛm a Ɔfa Nwomasua Ho (Accelerated Development Plan for Education). Saa nhyehyɛɛ yi dze mfe esia ahyɛse adzesua sii hɔ, sɛ wɔbɛkɔ bi a ɔbɛn amansan nyina mosea ɔbɛyɛ yie biara, a ndzɛmba ahorow a obotum aba a wobedzi ekyi.",
74164,"His room was messy and untidy, with dirty clothes and dishes all over the floor. Honestly, it was a very disgusting sight.","Nna nye dan mu ayɛ basabasa na ɔnyɛ dza hɔn ahyehyɛ no yie, na ntar a wɔayɛ fi na mprɛtse wɔ famu nyinara. Nokwarsɛm, nna ɔyɛ adze a ɔyɛ tan yie.",
96498,Traders across the country have shown their support for the mother union of traders (GUTA) by participating in a nationwide strike to bring to attention to the challenging economic conditions faced by traders in the country,Eguadzifo a wɔwɔ ɔman yi ne mfɛndzanan nyinara ada no edzi dɛ wɔtaa hɔn kuwbaatan (GUTA) ekyir dɛ wɔdze hɔnho hyɛ ɔman mu no etuatsew a wɔdze twee adze sii ɔhaw a sikasɛm ho nhyehyɛɛ ho haw a ɔwɔ ɔman yi mu no do.,
95465,"Anytime we get chance to visit the kenteweaver at Bonwire, we will know the type of kente and new ones and how it is been weaved.","Aberbiara a yebenya kwan akɔ kentewenbea a ɔwɔ Bonwire no, yebohu kente ahorow na afofor na mbrɛ wosi wen.",
73876,"Additional coastal states as well as other states farther inland eventually signed the Bond, and British influence was accepted, strengthened, and expanded.","Ewiei koraa no, aman fofor a wɔwɔ mpoano na aman fofor a wɔwɔ asase no ne finimfin no so hyɛɛ Apam no ase, na wɔgyee Britain nhyɛdo no too mu, wɔhyɛɛ no dzen, na wɔtserɛw mu.",
95766,They rejected the government's proposal so there has to be a deliberation on it again.,Ɔanngye aban no n’edzeserɛdze no annto mu ntsi wɔbɛsan akobobow ho,
96184,He was the fourth and last of his parents' children.,Nna ɔtɔ do anan wɔ n'awofo hɔn mba baanan mu.,
75720,The program was a government initiative to help people who cannot access education services.,Nna dwumadzi no yɛ aban nhyehyɛɛ dɛ ɔdze bɔboa hɔn a wonnkotum ennya skuul mu kwan no.,
75231,The council is rerying on the business group to finance the project.,Abaguakuw no redan edwumakuw ahorow ma wɔaboa hɔn dwumadzi no wɔ sika afa mu,
95029,"She left four children behind, their names are; Prince Charles who was born in 1948, Princess Anne born in 1950, Prince Andew and Prince Edward born in 1960 and 1964 respectively, and had twelve grandchildren.","Ogyaa mbofra anan wɔ n'ekyir, hɔn edzin nye; Prince Charles a wɔwoo no wɔ 1948 mu, Princess Anne a wɔwoo no wɔ 1950 mu, Prince Andew na Prince Edward a wɔwoo hɔn wɔ 1960 na 1964 mu pɛpɛɛpɛr, nna ɔwɔ nananom duebien.",
94575,"He was hereby charged with five offences, including attempting to bribe the police officer with GH ȼ400","Wɔbɔ no kwaadu enum,a reyɛ ama polisinyi  adamudze GH ȼ400 kaho.",good
94478,"Based on the mechanism of occurrence, we will divide it into two parts; Primary and secondary hypertension.","Sɛ yɛhwɛ dza ɔdze ba a, yebekyɛmu ebien ; ahyɛase na sekendari mbogya mbordo.","Sɛ yɛhwɛ dza ɔdze ba a, yebɛkyɛmu ebien ; praemri na sekendri mbogya mbordo."
96561,"About two months ago, due to the financial difficulties faced by the country, Ghana decided to seek assistance from the International Monetary Fund","Bɛyɛ bosoom ebien a abɛsen kɔ yi, osian sikasɛm ho haw a ɔman yi refa mu ntsi, Ghana sii gyinae dɛ ɔbɔkɔ akɔgye mboa wɔ IMF",
75359,The drugs received by hospitals last for a short period of time.,Ndur a ayarsabea no nsa kae no annkyɛr na ɔsae,
95431,All these are negative effects social media has on today's youth.,Iyinom nyinara yɛ nsunsuando bɔn a sohyial midia wɔ no wɔ ndɛ mbabu do.,
75503,The hospital contractor was given forty days to complete the construction project.,Wɔmaa nyia orisi asopitsi no nda eduanan dɛ ɔmfa nwie edwuma no,
96536,"Indeed, the Queenmother's blood relation with the King gives her a unique insight into the royal family and the qualities required for a suitable successor. This traditional belief emphasizes the importance of her role in selecting the next King, as her closeness to the royal lineage allows her to make a well-informed decision. The analogy of the frog from the river announcing the crocodile's death highlights the significance of respecting traditional wisdom and authority without question.","Ampaara, ɔbaahembaa no nye ɔhen no wɔ bɔgya mu twaka ntsi na ɔma no ho kwan wɔ ebusuadehye no mu na su papa a wɔrohwehwɛ fi obi a obedzi adze no hɔ. Amambra mu gyedzi si no dwumadzi no ho hia a ohia dɛ ɔpaw ɔhen fofor, dɛ mbrɛ ɔbɛn ahendzi no ntsi ɔma no kwan ma ɔdze adwenkyerɛ a odzi mu to gua. Atwɛr a ofi nsuadze bɛka dɛnkyɛm no wu ho atsesɛm da hia a ohia dɛ yɛdze bu ma nyimdzee a amambra dze to gua na banodzifo ber a yemmbisa ho asɛm biara. no",
95996,"Two of a person's palms are raised in the air when they dance in public, hitting the chest to represent their control over the land.",Nyia ɔresaw no ma ne nsa ebein no do wɔ wimu dze ne nsa si no bo dze kyerɛ dɛ tum a ɔwɔ wɔ asaase no do,
95453,"These kings, Queens and other prominents people their zeal, boldness, selfless, truthful and their love they have for the Asante Kingdom, this let them fought and protect the Golden stool and the Asantes' have their peace.","Dɛm ahemfo, Mbaahembaafo na adzefo binom hɔn ahokeka, akokodur, ahofama, nokwadzi na hɔn dɔ a wɔwɔ ma Esuantse Ahenman no, iyi ma wɔkoe na wɔbɔɔ sikagua no ho ban na Esuantsefo no wɔ hɔn asomdwee.",
75563,The liver infection causes no symptoms; all symptoms of malaria result from the infection of red blood cells.,Berɛbo mu yarba no mma nsɛnkyerɛdze biara; etsiridii ho nsɛnkyerɛdze no nyinara yɛ dza ofi bɔgya nkwabowa mu yarba no.,
76127,Usually car drivers who cause a road accident tend to run away from the police.,Mpɛn pii no ahɛnkafo a wɔdze kaar nya akwanhyia no guan aporisifo.,
75712,The president promised to construct a district hospital for the people of Twifo Praso,Ɔmampanyin no hyɛɛ bɔ dɛ obesi mansin ayarsabea ama Twifo Prasofo.,
74474,Money donations to people cannot help fight poverty in villages.,Sika a wɔdze ma nyimpa no nntum mboa ma wɔko ntsia ohia wɔ nkuraase.,
76214,"When a catch is made, message gets to the people in town within minutes and this turns the people into jubilation.","Sɛ wɔkyer abowa a, hɔn a wɔwɔ kurom no tse ho asɛm wɔ sema mu na iyi dze enyigye berɛ nkorɔfo no.",
96147,"All these people need to pay attention to these signs and take action, not later.","Otwar dɛ nkorɔfo yinom nyinara ma hɔn adwen kɔ nsɛnkyerɛdze yinom do na wodzi ho dwuma, na nna ekyirii bi.",
74268,Legislators play a big role in informing government what goes on in their constituencies.,Mbrahyɛbaguafo dzi dwuma kɛse wɔ aban amandzebɔ mu wɔ dza ɔkɔ do wɔ hɔn ambatow mpasua mu.,
74236,It's only the district council that decides which road to be constructed.,Ɔyɛ mansin abaguafo no nkotsee na ɔsi akwan a wɔbɛsi ho gyinae.,
95843,They named that cloth ''Weaved-cloth'' because it was weaved.,Wɔtoo  tam no dzin dɛm ɔnam dɛ wɔawen ntsi,
96105,"Also, the art of communicating with someone using symbols from the prints in a cloth has reduced; people wear the cloth based on how nice it is, not its name.",Nsɛnkyerɛdze a ɔwɔ tam a wɔdze kasa no so no do akɔ famu; nkorɔfo fura tam no wɔ ne fɛw ntsi na nnyɛ ne dzin ntsi.,
73944,Angule possessions that were left behind were sold since it were on the land illegally.,Wɔtɔɔn Angule n'egyapadze a ogyaa no ekyir nyina osiandɛ ɔammfa mbra kwan do na osii no wɔ asaase no do.,
96715,"Currently, culture and metaphor play a prominent role in issues in Ghana. However, from time to time, they have come to recognize that it is of no use.","Seseiara, amambra na ngyinahɔma dzi dwumason wɔ nsɛm mu wɔ Ghana. Eso, ofi ber to ber no, woehu dɛ no ho nnhia.",
96568,"As the news spread, many people expressed their satisfaction and happiness with the call for the appointment of a new Minister of Finance at the Presidency.","Dɛ mbrɛ asɛm no tahyee no, nkorɔfo beberee daa hɔn akomatɔyamu na enyigye edzi wɔ Sikasɛm Soafo ne mpawee wɔ Abankɛse mu no ho frɛ no ho.",
94312,Some women may also experience pain or bleeding during sexual intercourse and some also often feel pain in their vagina.,"Mbasiafo binom so tum tse yaw ana bɔgya tum tu hɔn wɔ aber a woridzi mpamu agor, na mpɛn pii no wɔtse yaw hɔn hɔn ‘baa’ no mu.",
95034,She was the overseer for some charity foundations and other 600 different companies.,"Nna ɔyɛ ɔhwɛdofo a ɔda ""charity foundations"" bi ano na ndwumakuw ahorow ahaesia.",
96452,"Because, when everyone is turning into animals you have to turn into one, Father Nkonto learned how to eat mushrooms and he enjoyed it very much. So when the mushroom was so wrinkled, it was very disturbing.","Osiandɛ, sɛ obiara redan abowa a ɔwɔ dɛ edan bi, Egya Nkonto suaa mbrɛ wosi dzi mbire na n'enyi gyee ho papaapa. Ntsi ber a mbire no twontwomee no, ɔhaw no ankasa.",
76032,They have supplied handwashing facilities to most of the areas in the country.,Wɔdze ndzɛmba a wɔdze hohor nsa ho akɔ mbea dodowara mu wɔ ɔman no mu.,
75884,The water used to be contaminated by sewage from the nearby toilet.,Nna nsufi a ɔsɔn fi egyananbea ɔbɛn nsu no mu no tɔ dɛ ɔsɛɛ nsu no.,
74672,People are always promised money each time the general elections approach.,"Ber biara a abatow ber robɔso no, wɔdze sika hyɛ nkorɔfo bɔ.",
75218,The contactor was urged to level the ground with the discontented workers.,Wɔkyerɛɛ nyia ɔreyɛ mpontudwuma no nye n’edwumayɛfo no dɛ wɔnyɛ edwuma no yie,
95345,Some also call it the Tano language.,Binom so frɛ no Tano kasa.,
74513,Most of the people spreading the coronavirus come from neighbouring countries.,Nyimpa dodow a wɔrobɔ coronavirus apetse no fi aman ahorow a woetwa hɛn ho ehyia mu.,
76065,This year's festive season may not be as exciting as usual since public gatherings have been banned,Afe yi mu afedzi no rennyɛ enyigye tse dɛ mbrɛ ɔtse dada no ber a wɔabra dɔm nhyiamu yi.,
76224,"When the fire started, it took the fire fighters, three hours to reach.","Ogya no hyɛɛ ase no, odumgya edwumayɛfo dzii dɔnhwer ebiasa wɔ ho ansaana worudu hɔ.",
94394,"Researchers say that coconut oil contains antioxidants that fight cancer, diabetes and some microorganisms that can harm the body.","Nhwehwɛmufo ka dɛ kube angoa wɔ edziban dur a ɔkõ tsia kokoram yarba, esikyire yarba na mbom a nketsenketse a wotum haw nyimpadua no.",modified.
95850,"In view of this, the natives of the town called it 'basket-woven cloth'( kenten-nwen ntoma). This, in time, was changed to 'Kente'.","No dɛm ntse, nkorɔfo a wɔwɔ hɔn atsenae hɔ no frɛ no kentsen tam. Iyi sesaa bɛyɛɛ ‘kente’",
74978,Some people take the risk and let tomorrow worry about its self.,Nkorɔfo binom fa kyakya no na wɔma ɔkyena dwen nankasa no ho.,
74281,Livelihood is the mean of securing the necessities of life.,Asetsenadze yɛ ɔkwan a wɔfa do nya asetsena mu ahiadze ahorow.,
94392,"For this reason, eating more grapes will help protect your body from many heart diseases and diseases.","Wɔ dɛm siantsir ntsi, grapes ne dzii beberee bɔ nyimpadua no ho ban fi akoma yarba ho.","Dɛm siantsir yi ntsi, grapes ne dzii beberee bɔ nyimpadua no ho ban fi akoma yarba ho."
94574,A Ukrainian citizen has been arrested for attempting to bribe a police officer after he caught him driving carelessly on the Accra-Tema motorway.,W'akyer Ukrainnyi bi dɛ ɔpɛdɛ ɔma polisinyi bi adamudze wɔ aber ohun dɛ ɔreka hɛn basabasa wɔ Nkran - Tema kwantsenpɔn no do.,Wɔakyer Ukrainnyi bi dɛ ɔpɛ dɛ ɔma polisinyi bi adamudze wɔ aber a ohun dɛ ɔreka hɛn basabasa wɔ Nkran - Tema kwantsenpɔn no do.
95085,"But when the fire Service personnel followed up to the hospital, the head doctor at the hospital told them that the child was dead when they brought him.","Naaso ber a Odumgya edwumayɛfo no dzii ekyir kɔɔ asopitsi hɔ no, datser panyin a ɔwɔ asopitsi hɔ no kaa kyerɛɛ hɔn dɛ ber a wɔdze abofra no bae no nna oewu.",
75321,The district medical department has to come with the necessary guiderines to combat tuberculosis.,Apɔwmudzen edwumayɛfo dze nhyehyɛɛ pa aba a ɔbɔboa dze ako etsia wɔwbɔ yarba,
96335,How can we bring laughter into our lives?,Yɛbɛyɛ dɛn dze serew aba hɛn abrabɔ mu?,
75974,There is easy access to the market for agricultural output and modern inputs.,Ekuadwuma mu ndɔbaa na abaɛfor ekuadwuma ho ndzɛmba nnka nsa wɔ guaman do.,
94338,This means that advanced and secondary schools are more likely to face these problems.,Dɛm kyerɛ dɛ ntuado skuul  wo kwan kɛse dɛ wɔ fa dɛm haw yi mu.,Dɛm kyerɛ dɛ ntoado skuul  wɔ kwan kɛse dɛ wɔfa dɛm haw yi mu.
95664,"If the child is a boy, she holds his hand and uses it to touch the cutlass and gun with no gunpowder and mentions the child's name and says grow and work hard for your wife and children.","Sɛ abofra no yɛ banyin a, ɔsuo ne nsa mu na ɔdze ka sekan na itur a boba biara nnyi mu na ɔbɔ abofra ne dzin na ɔka dɛ nyin na yɛ edwumadzen ma wo yer na wo mba.",
75816,The teachers complained about some of the students who don't attend classes.,Akyerɛkyerɛfo no hwinhwiin esuafo binom a wɔmmpɛ adzesuadan mu kɔ no ho.,
74539,"My cattle was raided last week, resulting in significant losses for me.","Wɔbɔtow hyɛɛ m'anantwikuw no do dapɛn a abɛsen no, na ama maahwer ndzɛmba pii.",
96644,"If we following the sweetness of the fish, we will fetch all the river Frao, we will end here our class here and continue another time","Sɛ yedzi adwen ne dɛw ekyir a, yɛbɔhwew Firaw,  yɛdze hɛn adzesua no besi ha na yɛatoa do ber fofor.",
95510,This kente represents a beautiful heavenly item with a special signs.,Dɛm kente yi gyina hɔ ma ahenman mu ahoɔfɛw a ɔwɔ nsɛnkyerɛdze soronko.,
74193,"In 1806, the Ashanti pursued two rebel leaders through Fante territory to the coast. The British refusal to surrender the rebels led to an Ashanti attack.","Wɔ afe 1806 mu no, Ashantifo no tsiaa etuatsewfo baanodzifo ebien faa Fante mbew mu kesi mpoano.",
73895,"After the funeral service, the president's body was taken on a military procession through some principal streets of the Ghanaian capital, Accra.","Ewufosom no ekyir no, nsordaafo no bepegyaa ɔmampanyin no fun no dze fefaa Ghana kuropɔn, Nkran, no brɔn akɛse no bi do.",
95934,"When we see a symbol of a finger pointing to the section beneath the eye on a linguist staff, it depicts a person who does not have a helper in times of trouble but believes that God intervenes on behalf of such a person despite this.","Sɛ ihu nsa a wɔdze akyerɛ enyi ase wɔ akyeampoma do , ɔkyerɛ nyimpa a onnyi boafo wɔ n’ahokyer ber mu na ɔwɔ gyedzi dɛ Nyame bɔboa no",
94400,"Experts say that the fiber content of apples is very high so if a person eats this fruit regularly, such a person is less likely to develop heart disease and can also help to reduce obesity.","Abenfo ka dɛ fibre muadze a ɔwɔ apɛr mu no wɔ sor ntsi sɛ obi dzi no daa a, anhwɛ no yie a nyimpa yi wɔ kwan kakraebi dɛ obenya  akoma yarba na ɔtsew kɛse yɛ mbordo do.","Abenfo ka dɛ faeba dodow a ɔwɔ apɛr mu no wɔ sor ntsi sɛ obi dzi no daa a, annhwɛ no yie a nyimpa yi wɔ kwan kakraabi dɛ obenya  akoma yarba na ɔtsew kɛse yɛ mbordo do"
74591,On average twenty five children are killed or injured in conflicts every day.,"Sɛ yɛkyɛ mu pɛpɛɛpɛr a, mbofra eduonu enum na wokunkum hɔn anaa dɛ wopirapira wɔ wentwiwentwi mu da biara.",
75175,The church all over the world celebrate s some important days annually.,Asɔr a ɔwɔ wiadze afɛndzanan nyinara mu kaakaa mfaso nda afrenhyia.,
75154,The chairperson of the cooperative explained that they had set the launch date already.,Nkabɔmu guamutsenanyi no kyerɛkyerɛɛ mu dɛ wɔahyɛ ewiaber edzidzi da no dada.,
75920,There are high cases of child to child sexual intercourse in schools.,Mbofra nkakramba ntamu mpa-mu-nkitahodzi akɔ sor wɔ skuul mu.,
75347,The district wants to ensure proper hygiene and general cleanliness among the people.,Mansin no pɛ dɛ wɔhwɛ dɛ nkorɔfo dzi hɔn ho nyi mapa,
75410,"The Friday preceding the hunt is spectacular for Aboakyer; Tuafo invoke and outdoor Gye mesi (meaning restore, protect), while Dentsefo come out with Sekanba (a deadly small knife).","Fida no a wɔreyɛ krado akɛkyer aboa no, Tuafo gu nsa na woyi Gye mesi ber a Dentsefo dze Sekanba pue",
75567,The local government has low revenue collection despites its effort to boost its income stream,"Mansin no mbɔdzembɔ dɛ obotu ne mfasonya mu mpon nyinara mu no, onnya towgyegye kɛse.",
96587,"The NPP Members of Parliament held a press conference when a significant number of the general public were calling for Ken Ofori-Atta's resignation, citing the ongoing financial difficulties being experienced in the country.","NPP Mbrahyɛbaguanyi yɛɛ nsɛnkyerɛwfo nhyiamu ber a nna amamfo dodowara rohwehwɛ dɛ Ken Ofori-Attah begyaa ne dzibew no ato famu no, ɔbɔɔ sikasɛm ho haw a ɔman no refa mu no do.",
74171,"However, this customary practice has long been shelved because sometimes the date could fall on or soon after the Christian Easter celebrations resulting in difficulties and inconveniences for some would be festival attendants.","Nanso, wɔdze saa amandze kwan do adzeyɛ yi ato nkyɛn ber tsentsen osiandɛ ɔtɔ mber bi a da no botum atɔ Kristofo Easter afahyɛ ahorow no do anaadɛ ɔno ekyi ber tsiaa bi a ɔdze nkõdzen na ɔhaw ahorow bɛba ama ibinom a wɔbɛyɛ afahyɛ no asefo.",
76082,"Through voting, voters make a decision of who should lead them.",Yɛnam ambatow do ma hɔn a wɔtow amba si gyinae wɔ nyia a otwar dɛ odzi hɔn enyim ho.,
74654,Parents should not allow their children to stay outside at night.,Onnyi dɛ awofo ma hɔn mba kwan ma wɔtsena paado anago.,
96745,"Due to the recent spike in economic conditions, the cost of premix fuel has increased significantly, posing challenges for fishermen in accessing it for their work. As a result, many fishermen have been forced to suspend their fishing activities","Osian ndansa yi sikasɛm ho haw a ɔbae ntsi, fangoo a afarfo dze yɛ edwuma no bo akɔ sor koraa, iyi dze ɔhaw abɔto afarfo no do ma wonntum nntɔ mmfa nnyɛ edwuma. Iyi sɛso ntsi, afarfo dodowara na woegyaa hɔn nam dwuma no ato hɔ.",
94669,Mercy is a main character that most people like and even watch learn some of her actions.,Mercy yɛ nyimpa tsitsir a nyimpa dodow no ara enyi gye ho na mpo hwɛ sua nye ndzeyɛɛ no bi.,good
75124,The Bibiani-Anhwiaso-Bekwai people chased off people from the bank of River Ankobra,Bibiani-Anhwiaso-Bekwai nkorɔfo no kaa nkorɔfo do fii Esutsen Ankobra n'egya.,
94514,"Research suggests that this yin drug often causes heart attack, high blood pressure, heart attack, sawa/health disease later, but no studies have been done to prove it.","Nhwehwɛmu susu dɛ dɛm yin edur yi mpɛn pi dze akoma yarba, mbogya mbordo, nsawa yarba, nanso suahun biara ntum nsido dua.",good
96322,We have an aversion to water in the body when a person is stressed and stressed.,Yepuw nsu wɔ hɛn honandua mu sɛ obi berɛ na ɔtseetsee a.,
75902,The youth leaders have joined the fight and will sensitize people from every area.,Mbaabun abaanodzifo no akɛka ko no ho na wɔnye nkorɔfo afofor bɛkasa efi mbea nyina.,
74754,Polio is quite common in children under the age of five.,Polio taa kyer mboframa a hɔn mfe nndur mfe enum.,
74228,It is the government's responsibility to protect its citizens from any kind of danger.,Ɔyɛ aban no n’asodzii dɛ ɔbɔ nye amamfo ho ban efi esian biara mu.,
95891,Others find it challenging to release their solid waste because of how hard it becomes; some even have to help it off occasionally with their hands.,"Ɔyɛ dzen ma nkorɔfo dɛ wobegya hɔn nan ɔnam dzen a hɔn egyanan ayɛ ntsi. Ɔtɔfa bi a, otwar  binom mpo dze hɔn boa ma opue",
74851,Schools play a big role in teaching nationals how to read and write.,Skuul dzi dwumasun wɔ amanaman hɔn akenkan na nkyerɛwee ne nkyerɛe mu.,
75722,"The program works from three years on climate, agriculture and involving in resilience building.","Dwumadzi no yɛ edwuma fi mfe ebiasa wɔ wimu nsakyer, ekuayɛ na nhomdoyɛ mu.",
96086,"Instead of the old method of using leaves to alert people about the deadly traps that have been set, strips of red cloth are now knotted around the harmful traps.","Nkyɛ ebɛfa nkan no kwan a wɔdze hataw kyerɛ dɛ woesunsum mfir bɔn no, Ibotum dze kɔɔgyan mbom akyekyer mfir no ho.",
74461,"Mob justice is unlawful, and it is against human rights.","Basabasayɛfo pɛrpɛrdzi yɛ dza mbra mma ho kwan, na etsiaa hokwan ahorow a nyimpa wɔ ho.",
76201,"What is the project budget, asking about the allocated funds for the project.",Dwumadzi no no ho sikasɛm nhyehyɛɛ tse dɛn? Sikabotsen a wɔdze reyɛ edwuma no ho asɛmbisa.,
74413,Media has brought information to people that previously could not be reached.,Dawurbɔfo ahorow dze nsɛm dadaw a wentum ankɔ nyimpa no nkyɛn brɛ hɔn.,
76164,We need to be aware of social media propaganda during this lockdown,Otwar dɛ hɛn enyi da hɔ wɔ sohyia miidia akohwisɛm wɔ danmuhyɛber yi mu.,
75725,The project generally aims at creating a market for farm products and gives farmers a number of benefits in the Nandom districts,Dwumadzi no no botae nye dɛ obobue gua ama ekuadze a ɔbɛma ekuafo no mfaso pii wɔ Nandom mansin no mu.,
94520,"After that, if we want a spice that will give us a flat meat, we can cook the bones and carcasses of the same meat we want for a long time, and put the best spices and spices on it.","N'ekyir no, sɛ yɛ pɛ eduhuam a ɔbɛma hɛn mbogyanam ne nka a, yebotum anoa dɛm abowa noara no biew no ma w'akyɛr, nayɛdze eduhuam papa no egugudo.",good
96085,"In addition to these, they can use a cement pillar to mark the boundaries of the land.",Wobotum so sɛmɛntse dum so akyerɛ asaase no ne he.,
95207,His is anticipating that Mr Sarpong's case would become a lesson to others who indulge in that kind of act.,Ɔrohwehwɛ dɛ Owura Sarpong n'asɛm no bɛyɛ esuadze ama nkorɔfo a wɔda dɛm ndzeyɛɛ no bi edzi.,
